{
  "$schema": "https://json-schema.org/draft/2020-12/schema",
  "$id": "https://quizpane.org/schema/declarative-provider.json",
  "title": "QuizPane Declarative Bank",
  "type": "object",
  "additionalProperties": false,
  "required": ["schemaVersion", "title", "catalogs", "questions"],
  "properties": {
    "schemaVersion": { "enum": [2, 3] },
    "title": { "type": "string", "minLength": 1, "maxLength": 120 },
    "description": { "type": "string", "maxLength": 2000 },
    "answerPolicy": { "enum": ["included", "none"] },
    "catalogs": {
      "type": "array",
      "minItems": 1,
      "items": {
        "type": "object",
        "additionalProperties": false,
        "required": ["id", "title", "practice"],
        "properties": {
          "id": { "$ref": "#/$defs/id" },
          "title": { "type": "string", "minLength": 1, "maxLength": 80 },
          "description": { "type": "string", "maxLength": 500 },
          "practice": {
            "type": "object",
            "additionalProperties": false,
            "required": ["mode"],
            "properties": {
              "mode": { "enum": ["all", "sequential", "random"] },
              "questionCount": { "type": "integer", "minimum": 1, "maximum": 200 },
              "preferMistakes": { "type": "boolean", "default": false }
            }
          }
        }
      }
    },
    "materials": {
      "type": "array",
      "items": { "$ref": "#/$defs/material" }
    },
    "questions": {
      "type": "array",
      "minItems": 1,
      "items": { "$ref": "#/$defs/question" }
    }
  },
  "allOf": [
    {
      "if": { "properties": { "schemaVersion": { "const": 3 } } },
      "then": { "required": ["answerPolicy"] }
    },
    {
      "if": { "required": ["answerPolicy"], "properties": { "answerPolicy": { "const": "none" } } },
      "then": {
        "properties": {
          "questions": { "items": { "not": { "anyOf": [{ "required": ["answer"] }, { "required": ["solution"] }] } } }
        }
      },
      "else": {
        "properties": {
          "questions": { "items": { "required": ["answer", "solution"] } }
        }
      }
    }
  ],
  "$defs": {
    "id": { "type": "string", "pattern": "^[a-z0-9][a-z0-9._-]{0,95}$" },
    "normalizedCrop": {
      "type": "object",
      "additionalProperties": false,
      "required": ["x", "y", "width", "height"],
      "properties": {
        "x": { "type": "number", "minimum": 0 },
        "y": { "type": "number", "minimum": 0 },
        "width": { "type": "number", "exclusiveMinimum": 0 },
        "height": { "type": "number", "exclusiveMinimum": 0 }
      }
    },
    "asset": {
      "type": "object",
      "additionalProperties": false,
      "required": ["path"],
      "properties": {
        "path": { "type": "string", "pattern": "^assets/[A-Za-z0-9._/-]+$" },
        "alt": { "type": "string", "maxLength": 500 },
        "sourceDocument": { "type": "string", "maxLength": 300 },
        "sourcePage": { "type": "integer", "minimum": 1 },
        "autoCrop": { "$ref": "#/$defs/normalizedCrop" },
        "crop": { "$ref": "#/$defs/normalizedCrop" }
      }
    },
    "source": {
      "type": "object",
      "additionalProperties": false,
      "properties": {
        "document": { "type": "string", "maxLength": 300 },
        "page": { "type": "integer", "minimum": 1 },
        "questionNumber": {
          "oneOf": [
            { "type": "integer", "minimum": 1 },
            { "type": "string", "minLength": 1, "maxLength": 40 }
          ]
        },
        "questionLabel": { "type": "string", "maxLength": 40 },
        "sectionId": { "$ref": "#/$defs/id" },
        "sectionTitle": { "type": "string", "minLength": 1, "maxLength": 120 }
      }
    },
    "materialSource": {
      "type": "object",
      "additionalProperties": false,
      "properties": {
        "document": { "type": "string", "maxLength": 300 },
        "page": { "type": "integer", "minimum": 1 }
      }
    },
    "material": {
      "type": "object",
      "additionalProperties": false,
      "required": ["id", "catalogId"],
      "properties": {
        "id": { "$ref": "#/$defs/id" },
        "catalogId": { "$ref": "#/$defs/id" },
        "title": { "type": "string", "maxLength": 200 },
        "body": { "type": "string", "maxLength": 100000 },
        "underlines": {
          "type": "array",
          "items": {
            "type": "object",
            "additionalProperties": false,
            "required": ["start", "length"],
            "properties": {
              "start": { "type": "integer", "minimum": 0 },
              "length": { "type": "integer", "minimum": 1 }
            }
          }
        },
        "images": {
          "type": "array",
          "maxItems": 20,
          "items": { "$ref": "#/$defs/asset" }
        },
        "source": { "$ref": "#/$defs/materialSource" },
        "review": {
          "type": "object",
          "additionalProperties": false,
          "properties": {
            "confidence": { "type": "number", "minimum": 0, "maximum": 1 },
            "needsReview": { "type": "boolean" },
            "reason": { "type": "string", "maxLength": 1000 },
            "riskLevel": { "enum": ["hard", "soft"] },
            "signals": { "type": "array", "items": { "type": "string" } }
          }
        }
      }
    },
    "option": {
      "type": "object",
      "additionalProperties": false,
      "required": ["id", "text"],
      "properties": {
        "id": { "$ref": "#/$defs/id" },
        "text": { "type": "string", "minLength": 1, "maxLength": 4000 },
        "image": { "$ref": "#/$defs/asset" }
      }
    },
    "question": {
      "type": "object",
      "additionalProperties": false,
      "required": ["id", "catalogId", "type", "stem", "options"],
      "properties": {
        "id": { "$ref": "#/$defs/id" },
        "catalogId": { "$ref": "#/$defs/id" },
        "materialId": { "$ref": "#/$defs/id" },
        "type": { "enum": ["single_choice", "multiple_choice", "true_false"] },
        "stem": { "type": "string", "minLength": 1, "maxLength": 20000 },
        "stemUnderlines": { "$ref": "#/$defs/material/properties/underlines" },
        "stemImage": { "$ref": "#/$defs/asset" },
        "options": { "type": "array", "minItems": 2, "maxItems": 20, "items": { "$ref": "#/$defs/option" } },
        "answer": {
          "type": "object",
          "additionalProperties": false,
          "required": ["optionIds"],
          "properties": {
            "optionIds": { "type": "array", "minItems": 1, "uniqueItems": true, "items": { "$ref": "#/$defs/id" } }
          }
        },
        "solution": { "type": "string", "maxLength": 20000 },
        "aiSolution": { "type": "string", "minLength": 1, "maxLength": 20000 },
        "source": { "$ref": "#/$defs/source" },
        "review": {
          "type": "object",
          "additionalProperties": false,
          "properties": {
            "confidence": { "type": "number", "minimum": 0, "maximum": 1 },
            "needsReview": { "type": "boolean" },
            "reason": { "type": "string", "maxLength": 1000 },
            "riskLevel": { "enum": ["hard", "soft"] },
            "signals": { "type": "array", "items": { "type": "string" } }
          }
        }
      }
    }
  }
}
